{
  "schemaVersion": 2,
  "revision": 20,
  "availability": "available",
  "playback": "playing",
  "trackedOutput": {
    "name": "AudioDevice on the Eastern Gallery Wall Beside the Tall Windows Overlooking the Courtyard"
  },
  "trackedZone": {
    "name": "Living Room, Library, Conservatory, North Hall, and the Entire Lantern-Lit Upper Floor"
  },
  "nowPlaying": {
    "title": "Last Light on Phobos",
    "artist": "Evelyn Lark & The Orbital Choir",
    "album": "Signals from the Quiet Sea"
  },
  "progress": null,
  "artwork": {
    "revision": 3,
    "path": "fixtures/artwork/playing.svg"
  }
}
