{
  "schemaVersion": 2,
  "revision": 9,
  "availability": "available",
  "playback": "playing",
  "trackedOutput": {
    "name": "NUC HDMI"
  },
  "trackedZone": {
    "name": "Gallery"
  },
  "nowPlaying": {
    "title": "Across the Room",
    "artist": "ODESZA",
    "album": "A Moment Apart"
  },
  "progress": null,
  "artwork": {
    "revision": 9,
    "path": "fixtures/artwork/revised.svg"
  }
}
