{
  "schemaVersion": 2,
  "revision": 16,
  "availability": "available",
  "playback": "playing",
  "trackedOutput": {
    "name": "AudioDevice"
  },
  "trackedZone": {
    "name": "Living Room"
  },
  "nowPlaying": {
    "title": "Last Light on Phobos",
    "artist": null,
    "album": "Signals from the Quiet Sea"
  },
  "progress": null,
  "artwork": {
    "revision": 3,
    "path": "fixtures/artwork/playing.svg"
  }
}
