{
  "schemaVersion": 2,
  "revision": 28,
  "availability": "available",
  "playback": "playing",
  "trackedOutput": {
    "name": "Speaker System"
  },
  "trackedZone": {
    "name": "Living Room"
  },
  "nowPlaying": {
    "title": "Dark Matte Calibration",
    "artist": "Synthetic Fixture",
    "album": "Forever and a Day direction"
  },
  "progress": {
    "positionSeconds": 202,
    "durationSeconds": 276,
    "sampledAt": "2026-08-15T19:20:00Z"
  },
  "artwork": {
    "revision": 28,
    "path": "src/shared/fixtures/artwork/forever-direction.jpg"
  }
}
