{
  "schemaVersion": 2,
  "revision": 21,
  "availability": "available",
  "playback": "playing",
  "trackedOutput": {
    "name": "AudioDevice"
  },
  "trackedZone": {
    "name": "Living Room"
  },
  "nowPlaying": {
    "title": "Last Light on Phobos",
    "artist": "   ",
    "album": "\t"
  },
  "progress": {
    "positionSeconds": 171,
    "durationSeconds": 266,
    "sampledAt": "2026-08-15T19:20:00Z"
  },
  "artwork": {
    "revision": 3,
    "path": "fixtures/artwork/playing.svg"
  }
}
