{
  "schemaVersion": 2,
  "revision": 20,
  "availability": "available",
  "playback": "playing",
  "trackedOutput": {
    "name": "Speaker System with Floorstanding Loudspeakers Beside the Tall Windows Overlooking the Courtyard"
  },
  "trackedZone": {
    "name": "Living Room, Library, Conservatory, North Hall, and the Entire Lantern-Lit Upper Floor"
  },
  "nowPlaying": {
    "title": "Last Light on Phobos",
    "artist": "Evelyn Lark & The Orbital Choir",
    "album": "Signals from the Quiet Sea"
  },
  "progress": {
    "positionSeconds": 171,
    "durationSeconds": 266,
    "sampledAt": "2026-08-15T19:20:00Z"
  },
  "artwork": {
    "revision": 3,
    "path": "src/shared/fixtures/artwork/playing.svg"
  }
}
