{
  "schemaVersion": 2,
  "revision": 12,
  "availability": "available",
  "playback": "playing",
  "trackedOutput": {
    "name": "Speaker System"
  },
  "trackedZone": {
    "name": "Living Room"
  },
  "nowPlaying": {
    "title": "Radio Paradise",
    "artist": null,
    "album": null
  },
  "progress": null,
  "artwork": {
    "revision": 3,
    "path": "src/shared/fixtures/artwork/playing.jpg"
  }
}
