{
  "schemaVersion": 2,
  "revision": 13,
  "availability": "available",
  "playback": "playing",
  "trackedOutput": {
    "name": "Speaker System"
  },
  "trackedZone": {
    "name": "Living Room"
  },
  "nowPlaying": null,
  "progress": {
    "positionSeconds": 300,
    "durationSeconds": 266,
    "sampledAt": "2026-08-15T19:20:00Z"
  },
  "artwork": null
}
